{
    "$schema": "https://json-schema.org/draft/2020-12/schema",
    "$id": "https://hostnur.dev/contracts/v1/operation-request.schema.json",
    "title": "OperationRequest",
    "type": "object",
    "additionalProperties": false,
    "required": [
        "protocol_version",
        "request_id",
        "idempotency_key",
        "operation",
        "parameters"
    ],
    "properties": {
        "protocol_version": { "const": 1 },
        "request_id": { "type": "string", "format": "uuid" },
        "idempotency_key": { "type": "string", "format": "uuid" },
        "operation": { "type": "string", "minLength": 1 },
        "resource": {
            "type": "object",
            "additionalProperties": false,
            "required": ["kind", "id"],
            "properties": {
                "kind": { "type": "string", "minLength": 1 },
                "id": { "type": "string", "format": "uuid" }
            }
        },
        "parameters": { "type": "object" },
        "timeout_seconds": { "type": "integer", "minimum": 1, "maximum": 86400 }
    }
}
