{
    "protocol_version": 1,
    "request_id": "a1b2c3d4-e5f6-4a7b-8c9d-0e1f2a3b4c5d",
    "idempotency_key": "b1c2d3e4-f5a6-4b7c-8d9e-0f1a2b3c4d5e",
    "operation": "service.control",
    "resource": {
        "kind": "service",
        "id": "c1d2e3f4-a5b6-4c7d-8e9f-0a1b2c3d4e5f"
    },
    "parameters": {
        "action": "restart"
    }
}
